{
  "schema_name": "qwen38-qsa-h2-evidence.schema.json",
  "schema_version": 1,
  "evidence_status": "synthetic",
  "evidence_kind": "qwen38-pascal-qsa-context-sweep",
  "claim_status": "bounded-qsa-context-sweep-only",
  "repository_commit": "1111111111111111111111111111111111111111",
  "donor": {
    "id": "freetoken-qwen4-pr257-merge",
    "repository": "https://github.com/FlashML-org/FreeToken",
    "pull_request": 257,
    "ref": "bd8f3d519a48777bf22ee5c7c8f58f4f3ff31b40",
    "license": "Apache-2.0",
    "method": "upstream-qsa-context-sweep-reference"
  },
  "software": {
    "python": "3.12.0",
    "torch": "2.11.0+cu126",
    "cuda_runtime": "12.6",
    "triton": "3.6.0"
  },
  "hardware_inventory": {
    "path": "results/hardware/inventory-ecc-off-qsa-p4.json",
    "sha256": "2222222222222222222222222222222222222222222222222222222222222222",
    "profile_id": "ecc-off",
    "gpu_index": 0,
    "gpu_identity": {
      "index": 0,
      "name": "Tesla P4",
      "compute_capability": "6.1",
      "memory_mib": 8192,
      "uuid": "GPU-00000000-0000-0000-0000-000000000000",
      "pci_bus_id": "0000:02:00.0",
      "ecc_mode": "disabled",
      "pci_root": "pci0000:00",
      "numa_node": 0
    }
  },
  "profile": {
    "attention_backend": "qsa_sparse",
    "selected_path": "torch-fp32-reference",
    "reference_only": true,
    "topk_backend": "torch",
    "default_changed": false
  },
  "workload": {
    "model": "Qwen3.8-Flash-Next",
    "geometry": "tiny-qwen4-qsa",
    "contexts": [128, 512, 2048],
    "phases": ["prefill", "decode"],
    "batch_size": 1,
    "repeats": 1,
    "matrix_complete": true,
    "max_duration_seconds": 300,
    "sustained_load": false
  },
  "workspace_plans": [
    {"context_tokens": 128, "phase": "prefill", "selected_path": "torch-fp32-reference", "topk_backend": "torch", "plan": {"status": "unvalidated", "required_bytes": 768, "capacity_bytes": null, "headroom_bytes": null, "persistent_bytes": 256, "capture_resident_bytes": 0, "eager_transient_peak_bytes": 512, "categories": {"score": 128, "top_k": 128, "expand_gather": 128, "attention": 128, "state": 256}, "shapes": {}, "request": {"context_tokens": 128, "token_rows": 128, "phase": "eager"}}},
    {"context_tokens": 128, "phase": "decode", "selected_path": "torch-fp32-reference", "topk_backend": "torch", "plan": {"status": "unvalidated", "required_bytes": 768, "capacity_bytes": null, "headroom_bytes": null, "persistent_bytes": 256, "capture_resident_bytes": 0, "eager_transient_peak_bytes": 512, "categories": {"score": 128, "top_k": 128, "expand_gather": 128, "attention": 128, "state": 256}, "shapes": {}, "request": {"context_tokens": 128, "token_rows": 1, "phase": "eager"}}},
    {"context_tokens": 512, "phase": "prefill", "selected_path": "torch-fp32-reference", "topk_backend": "torch", "plan": {"status": "unvalidated", "required_bytes": 768, "capacity_bytes": null, "headroom_bytes": null, "persistent_bytes": 256, "capture_resident_bytes": 0, "eager_transient_peak_bytes": 512, "categories": {"score": 128, "top_k": 128, "expand_gather": 128, "attention": 128, "state": 256}, "shapes": {}, "request": {"context_tokens": 512, "token_rows": 512, "phase": "eager"}}},
    {"context_tokens": 512, "phase": "decode", "selected_path": "torch-fp32-reference", "topk_backend": "torch", "plan": {"status": "unvalidated", "required_bytes": 768, "capacity_bytes": null, "headroom_bytes": null, "persistent_bytes": 256, "capture_resident_bytes": 0, "eager_transient_peak_bytes": 512, "categories": {"score": 128, "top_k": 128, "expand_gather": 128, "attention": 128, "state": 256}, "shapes": {}, "request": {"context_tokens": 512, "token_rows": 1, "phase": "eager"}}},
    {"context_tokens": 2048, "phase": "prefill", "selected_path": "torch-fp32-reference", "topk_backend": "torch", "plan": {"status": "unvalidated", "required_bytes": 768, "capacity_bytes": null, "headroom_bytes": null, "persistent_bytes": 256, "capture_resident_bytes": 0, "eager_transient_peak_bytes": 512, "categories": {"score": 128, "top_k": 128, "expand_gather": 128, "attention": 128, "state": 256}, "shapes": {}, "request": {"context_tokens": 2048, "token_rows": 2048, "phase": "eager"}}},
    {"context_tokens": 2048, "phase": "decode", "selected_path": "torch-fp32-reference", "topk_backend": "torch", "plan": {"status": "unvalidated", "required_bytes": 768, "capacity_bytes": null, "headroom_bytes": null, "persistent_bytes": 256, "capture_resident_bytes": 0, "eager_transient_peak_bytes": 512, "categories": {"score": 128, "top_k": 128, "expand_gather": 128, "attention": 128, "state": 256}, "shapes": {}, "request": {"context_tokens": 2048, "token_rows": 1, "phase": "eager"}}}
  ],
  "allocator_checkpoints": [
    {"name": "post_load", "status": "measured", "context_tokens": null, "driver_total_bytes": 8589934592, "driver_free_bytes": 8589934592, "allocator_allocated_bytes": 0, "allocator_reserved_bytes": 0, "allocator_high_water_bytes": 0, "allocation_count": 0, "allocation_retries": 0, "allocation_failures": 0, "reason": null},
    {"name": "first_small_prefill", "status": "measured", "context_tokens": 128, "driver_total_bytes": 8589934592, "driver_free_bytes": 8589934592, "allocator_allocated_bytes": 1024, "allocator_reserved_bytes": 2048, "allocator_high_water_bytes": 2048, "allocation_count": 1, "allocation_retries": 0, "allocation_failures": 0, "reason": null},
    {"name": "first_large_prefill", "status": "measured", "context_tokens": 2048, "driver_total_bytes": 8589934592, "driver_free_bytes": 8589934592, "allocator_allocated_bytes": 1024, "allocator_reserved_bytes": 2048, "allocator_high_water_bytes": 2048, "allocation_count": 1, "allocation_retries": 0, "allocation_failures": 0, "reason": null},
    {"name": "steady_decode", "status": "measured", "context_tokens": 2048, "driver_total_bytes": 8589934592, "driver_free_bytes": 8589934592, "allocator_allocated_bytes": 1024, "allocator_reserved_bytes": 2048, "allocator_high_water_bytes": 2048, "allocation_count": 1, "allocation_retries": 0, "allocation_failures": 0, "reason": null},
    {"name": "startup_canary", "status": "unmeasured", "context_tokens": null, "driver_total_bytes": null, "driver_free_bytes": null, "allocator_allocated_bytes": null, "allocator_reserved_bytes": null, "allocator_high_water_bytes": null, "allocation_count": null, "allocation_retries": null, "allocation_failures": null, "reason": "not part of this context-only sweep"},
    {"name": "cancellation_state_restore", "status": "unmeasured", "context_tokens": null, "driver_total_bytes": null, "driver_free_bytes": null, "allocator_allocated_bytes": null, "allocator_reserved_bytes": null, "allocator_high_water_bytes": null, "allocation_count": null, "allocation_retries": null, "allocation_failures": null, "reason": "not part of this context-only sweep"}
  ],
  "samples": [
    {"id": "context-128-prefill-repeat-0", "context_tokens": 128, "phase": "prefill", "repeat": 0, "status": "passed", "synchronized": true, "total_elapsed_ns": 1000, "host_elapsed_ns": 1100, "phase_elapsed_ns": {"store_kv": 100, "index_cache_composite": 200, "selection_composite": 300, "selected_row_attention": 400}, "phase_event_count": 4, "phase_events": [{"phase": "store_kv", "layer_id": 3, "slot": 0, "path": "torch-fp32-reference", "elapsed_ns": 100}, {"phase": "index_cache_composite", "layer_id": 3, "slot": 0, "path": "torch-fp32-reference", "elapsed_ns": 200}, {"phase": "selection_composite", "layer_id": 3, "slot": 0, "path": "torch-fp32-reference", "elapsed_ns": 300}, {"phase": "selected_row_attention", "layer_id": 3, "slot": 0, "path": "torch-fp32-reference", "elapsed_ns": 400}], "output_sha256": "3333333333333333333333333333333333333333333333333333333333333333", "output_shape": [128, 256], "allocator_before": {"driver_total_bytes": 8589934592, "driver_free_bytes": 8589934592, "allocator_allocated_bytes": 0, "allocator_reserved_bytes": 0, "allocator_high_water_bytes": 0}, "allocator_after": {"driver_total_bytes": 8589934592, "driver_free_bytes": 8589934592, "allocator_allocated_bytes": 1024, "allocator_reserved_bytes": 2048, "allocator_high_water_bytes": 2048}},
    {"id": "context-128-decode-repeat-0", "context_tokens": 128, "phase": "decode", "repeat": 0, "status": "passed", "synchronized": true, "total_elapsed_ns": 1000, "host_elapsed_ns": 1100, "phase_elapsed_ns": {"store_kv": 100, "index_cache_composite": 200, "selection_composite": 300, "selected_row_attention": 400}, "phase_event_count": 4, "phase_events": [{"phase": "store_kv", "layer_id": 3, "slot": 0, "path": "torch-fp32-reference", "elapsed_ns": 100}, {"phase": "index_cache_composite", "layer_id": 3, "slot": 0, "path": "torch-fp32-reference", "elapsed_ns": 200}, {"phase": "selection_composite", "layer_id": 3, "slot": 0, "path": "torch-fp32-reference", "elapsed_ns": 300}, {"phase": "selected_row_attention", "layer_id": 3, "slot": 0, "path": "torch-fp32-reference", "elapsed_ns": 400}], "output_sha256": "3333333333333333333333333333333333333333333333333333333333333333", "output_shape": [1, 256], "allocator_before": {"driver_total_bytes": 8589934592, "driver_free_bytes": 8589934592, "allocator_allocated_bytes": 1024, "allocator_reserved_bytes": 2048, "allocator_high_water_bytes": 2048}, "allocator_after": {"driver_total_bytes": 8589934592, "driver_free_bytes": 8589934592, "allocator_allocated_bytes": 1024, "allocator_reserved_bytes": 2048, "allocator_high_water_bytes": 2048}},